{
  "id": "TASK-0005",
  "title": "Pre-register a GQ-010 baseline BEFORE merges change the graph",
  "status": "backlog",
  "priority": "critical",
  "domain": "research",
  "category": "research",
  "created_at": "2026-08-07T00:00:00Z",
  "created_by": "GLS-CONSOLIDATION",
  "evidence": "GQ-010's own evidence_gaps[0]: no agreed baseline exists for evidence-retrieval time or decision changes.",
  "verified": false,
  "target_agent": "",
  "dependencies": [],
  "spec": {
    "description": "GQ-010 has no baseline, so nothing downstream of it is measurable. This is TIME-CRITICAL in a way the other tasks are not: once the merges land, today's graph is gone and the before-picture cannot be reconstructed.",
    "context": "Pre-register 5 real decisions and time them against TODAY's graph before any merge changes it. Pre-registration must be frozen before the first measurement, and the module's own experimental-method.md makes the point that a Git commit should not replace an external preregistration - timestamp it somewhere not controlled by the analyst. Without this, any later claim that the work improved retrieval or decision quality is unfalsifiable.",
    "acceptance_criteria": [
      "5 decisions pre-registered with their measurement protocol frozen before the first timing",
      "Timings recorded against the pre-merge graph",
      "The registration is timestamped outside the analyst's own control"
    ]
  },
  "execution_log": [
    {
      "timestamp": "2026-08-07T00:00:00Z",
      "action": "seeded",
      "by": "GLS-CONSOLIDATION",
      "notes": "Seeded from the 2026-08-07 estate consolidation. Durable rationale in .agents/tasks/consolidation-source/."
    }
  ]
}
