{
  "id": "TASK-0003",
  "title": "Publish a successor Event recording the honest 8-of-13 delivery",
  "status": "backlog",
  "priority": "high",
  "domain": "lifecycle",
  "category": "content",
  "created_at": "2026-08-07T00:00:00Z",
  "created_by": "GLS-CONSOLIDATION",
  "evidence": "Delivered properly: 8 of 13. Lane 5 and Lane 6 never pushed; Lane 9 branch exists at 0 lines; Lane 12 shipped 165 lines of the wrong content.",
  "verified": false,
  "target_agent": "",
  "dependencies": [
    "TASK-0001"
  ],
  "spec": {
    "description": "The immutable launch Event records the program as launched. No record states what actually landed. Write a SUCCESSOR Event naming lanes 5, 6, 9 and 12 explicitly.",
    "context": "NEVER edit the immutable launch Event - corrections are successor Events. The program already discovered this class of problem itself: prompt-evolution.md records that 'A later GitHub audit showed that several branch names existed but were identical to main. This record explicitly distinguishes branch reservation from durable pushed work.' Eight of the eleven deleted Erdos refs pointed at one identical commit, the same pattern. Also record that the 20 drafts were the SPECIFIED output, not a failure: parallel-slam.md states 'Some will be merge-ready; some will reveal incompatible assumptions or produce pilots that should be killed. That is expected.' The accepted successor Event 2026-08-08-people-graph-parallel-program-integrated.json already records the honest delivery counts; the remaining criterion is explicit lane 5/6/9/12 naming in a successor. Do not rewrite the launch Event or repeat completed merges.",
    "acceptance_criteria": [
      "A successor Event exists naming lanes 5, 6, 9 and 12",
      "The immutable launch Event is unmodified and check:immutable still passes"
    ]
  },
  "execution_log": [
    {
      "timestamp": "2026-08-07T00:00:00Z",
      "action": "seeded",
      "by": "GLS-CONSOLIDATION",
      "notes": "Seeded from the 2026-08-07 estate consolidation. Durable rationale in .agents/tasks/consolidation-source/."
    },
    {
      "timestamp": "2026-09-08T06:32:26+07:00",
      "action": "Reviewed remaining acceptance and repeat-work boundary",
      "by": "LIBRARY-ASTRA",
      "notes": "The accepted successor Event 2026-08-08-people-graph-parallel-program-integrated.json already records the honest delivery counts; the remaining criterion is explicit lane 5/6/9/12 naming in a successor. Do not rewrite the launch Event or repeat completed merges."
    }
  ]
}
