{
  "id": "TASK-0008",
  "title": "Provide safe read-only discovery, inspection and task entry through gls",
  "status": "completed",
  "priority": "high",
  "domain": "ui",
  "category": "feature",
  "created_at": "2026-09-08T06:32:26+07:00",
  "created_by": "LIBRARY-ASTRA",
  "target_agent": "Library maintainer",
  "evidence": "scripts/read-library.mjs; tests/gls-read.test.mjs; docs/gls.md",
  "verified": true,
  "spec": {
    "description": "Make a cold agent able to resolve source state and owning entry through the existing Library CLI and read canonical task scope without assembling several projections by hand.",
    "objectives": [
      "Bounded search and exact Work inspection with source freshness checks.",
      "Full canonical task inspection without a generated-site dependency.",
      "Refuse traversal, symlink escape, stale inputs and inconsistent dossiers."
    ],
    "acceptance_criteria": [
      "Focused Node 20 read/add contract suites pass.",
      "Real current-registry search/inspection returns the selected Runtime source and correct private/unselected Harness boundary.",
      "A cold lower-capability reader can use the commands and return a checkable source receipt.",
      "No input mutation or public deployment is performed."
    ],
    "context": "Implemented by a bounded context-clean Luna worker, with owner review corrections before acceptance. This is not a comparative token-efficiency result."
  },
  "execution_log": [
    {
      "timestamp": "2026-09-08T06:32:26+07:00",
      "action": "Implementation and owner review completed; integration acceptance pending",
      "by": "LIBRARY-ASTRA",
      "notes": "Read CLI writer delivered commands/tests. Owner found unsafe generated slugs, intermediate symlinks and missing full task context; writer corrected them with regression cases."
    },
    {
      "timestamp": "2026-09-08T09:47:34+07:00",
      "action": "Owner accepted bounded implementation",
      "by": "LIBRARY-ASTRA",
      "notes": "Full Node20 Library gate passed. Read CLI source reviewed and corrected; focused regressions and real Runtime/Harness projection reads passed."
    }
  ]
}
