{
  "id": "TASK-0002",
  "title": "Merge the three docs-only branches",
  "status": "completed",
  "priority": "medium",
  "domain": "lifecycle",
  "category": "infrastructure",
  "created_at": "2026-08-07T00:00:00Z",
  "created_by": "GLS-CONSOLIDATION",
  "evidence": "agent/people-graph-audit-record-20260806 (15 commits), gls/people-graph-source-research-20260806 (8), agent/first-principles-people-graph-program-2026-08-06 (4).",
  "verified": true,
  "target_agent": "",
  "dependencies": [
    "TASK-0001"
  ],
  "spec": {
    "description": "Three documentation branches with no conflict risk. The audit record holds findings PG-AUDIT-001 to 013, each pinning exact blob revisions, plus a 509-line complete-decision-record. Source research holds the 39-source matrix, rights and deletion matrix, 10 value theses and the pilot portfolio. First-principles holds R1-R10 and the value function.",
    "context": "These also carry the ONLY surviving copies of the Lane 5 and Lane 6 work orders (prompts/parallel-slam.md and prompts/dependency-ordered-superseded.md). Until they are merged, the specs for two unshipped P0 fixes are reachable only by knowing the branch name - the exact 'correct findings, unreachable' failure this consolidation exists to end. Historical pre-merge scope is preserved below. Its completion is now evidenced by canonical-main ancestry and the owner verification receipt; do not repeat the merge.",
    "acceptance_criteria": [
      "All three merged",
      "The prompt packs are reachable from main"
    ]
  },
  "execution_log": [
    {
      "timestamp": "2026-08-07T00:00:00Z",
      "action": "seeded",
      "by": "GLS-CONSOLIDATION",
      "notes": "Seeded from the 2026-08-07 estate consolidation. Durable rationale in .agents/tasks/consolidation-source/."
    },
    {
      "timestamp": "2026-09-08T06:32:26+07:00",
      "action": "Reconciled completed work against canonical main",
      "by": "LIBRARY-ASTRA",
      "notes": "Verified merge ancestry on main: cf56b628e7733d3150d905168a2f8bf987ca15ea, 3740886189cfc9427e993c28f4feb138df52e375, d4ca2f850ab99aa9dde1b1829c6b43de328cc2a3. The accepted 2026-08-08 People Graph integration Event records the fold-in. Current-main a6cfb54152ba7cf08e258ff7fd43159ff97ab562 passed npm ci and npm run verify on Node 20; no new merge performed."
    }
  ]
}
