{
  "id": "TASK-0007",
  "title": "Integrate the shared Library reading frame for review",
  "status": "in_progress",
  "priority": "high",
  "domain": "ui",
  "category": "feature",
  "created_at": "2026-09-08T05:29:49+07:00",
  "created_by": "LIBRARY-ASTRA",
  "target_agent": "Library reramp owner",
  "evidence": "docs/library-ui-spec.md; docs/library-ui-renewal.md; source proposals great-library-of-siso#21/#23/#24 and siso-shell#1",
  "verified": false,
  "spec": {
    "description": "A locally verified shared reading flow with exact source pins, preserving public identity and original reader content. Public publication is a separate gate.",
    "objectives": [
      "One CRM-derived frame across Library HTML routes.",
      "Keep registered/selected/private states truthful and source-owned.",
      "Expose the existing Harness metadata proposal in a local preview."
    ],
    "acceptance_criteria": [
      "Node 20 full Library gate and strict integration diagnostic pass.",
      "Every generated HTML route has one shared navigation and main landmark, working local anchors and source parity.",
      "Representative desktop/mobile, keyboard, storage-denied and no-JS browser checks pass.",
      "Public hosts and peer checkouts remain unchanged."
    ],
    "context": "Single owner on a review branch. No helpers or public-main publication."
  },
  "execution_log": [
    {
      "timestamp": "2026-09-08T05:29:49+07:00",
      "action": "Started from current main after source recovery and baseline verification",
      "by": "LIBRARY-ASTRA",
      "notes": "Node 20 npm ci and npm run verify passed; prior open-PR work reviewed and preserved."
    },
    {
      "timestamp": "2026-09-08T09:47:34+07:00",
      "action": "Checkpoint current stretch; broader acceptance remains",
      "by": "LIBRARY-ASTRA",
      "notes": "Full gate passed with 98 HTML readers and 20 source documents preserved. Representative desktop/mobile and focus/no-JS/storage-denied checks passed after a mobile card-width fix. Full route-family visual matrix, 200% enlargement and public deployment readback remain separate. Resume only remaining acceptance from the run continuation."
    }
  ]
}
