{
  "id": "TASK-0001",
  "title": "Merge the People Graph control-plane spine",
  "status": "completed",
  "priority": "high",
  "domain": "lifecycle",
  "category": "infrastructure",
  "created_at": "2026-08-07T00:00:00Z",
  "created_by": "GLS-CONSOLIDATION",
  "evidence": "Branch gls/people-graph-parallel-spine-20260806, 26 commits. Additive schema only; modifies no immutable record.",
  "verified": true,
  "target_agent": "",
  "dependencies": [],
  "spec": {
    "description": "The spine carries ADR-0005, the Works and Releases records, V37, GQ-010 and the pg-observation-0.1 interchange format. It is the control plane the rest of the program hangs off.",
    "context": "Verify with: npm ci && npm run check:immutable && npm run verify. It is additive-schema-only and touches no immutable record, which is why it is safe to merge before the lanes it describes are finished. Merge this BEFORE the docs-only branches so their references resolve. Historical pre-merge scope is preserved below. Its completion is now evidenced by canonical-main ancestry and the owner verification receipt; do not repeat the merge.",
    "acceptance_criteria": [
      "npm run check:immutable passes",
      "npm run verify passes",
      "No immutable record is modified"
    ]
  },
  "execution_log": [
    {
      "timestamp": "2026-08-07T00:00:00Z",
      "action": "seeded",
      "by": "GLS-CONSOLIDATION",
      "notes": "Seeded from the 2026-08-07 estate consolidation. Durable rationale in .agents/tasks/consolidation-source/."
    },
    {
      "timestamp": "2026-09-08T06:32:26+07:00",
      "action": "Reconciled completed work against canonical main",
      "by": "LIBRARY-ASTRA",
      "notes": "Verified merge ancestry on main: 08f5275e1a8075f504a33d1cf37530941c94132f. The accepted 2026-08-08 People Graph integration Event records the fold-in. Current-main a6cfb54152ba7cf08e258ff7fd43159ff97ab562 passed npm ci and npm run verify on Node 20; no new merge performed."
    }
  ]
}
