{
  "id": "TASK-0004",
  "title": "Own the missing convergence step: the adversarial release gate",
  "status": "backlog",
  "priority": "high",
  "domain": "lifecycle",
  "category": "gap",
  "created_at": "2026-08-07T00:00:00Z",
  "created_by": "GLS-CONSOLIDATION",
  "evidence": "v0 Prompt 12 in prompts/dependency-ordered-superseded.md on agent/people-graph-audit-record-20260806. Dropped entirely by the parallel redesign; nobody owns it.",
  "verified": false,
  "target_agent": "",
  "dependencies": [
    "TASK-0001",
    "TASK-0002"
  ],
  "spec": {
    "description": "Prompt 13 evaluates COMPATIBILITY; v0 Prompt 12 would have PROVEN the P0s fixed and published the closing Event. The spec survives and is reusable. Nobody currently owns final convergence.",
    "context": "Eight named gates including 'Regression: run Prompt 1's original failure fixtures and prove the selected P0s are resolved' and the rule 'do not paper over a red gate'. It also owned registering Works, immutable Release manifests 'for the code/data-contract versions actually proven - not for unbuilt production data', the snapshot, and the closing Event. Numbering trap: v0 Prompt 12 is NOT parallel-slam Prompt 12 (claims/temporal) - see .docs/lane-numbering-map.html. The last accepted Library integration Event reports unresolved People Graph success criteria, not an accepted adversarial release gate. Ownership and selected-P0 replay evidence remain unestablished; no source/runtime repair is claimed by this Library review.",
    "acceptance_criteria": [
      "An owner is named for the release gate",
      "Prompt 1's original failure fixtures are run and the selected P0s proven resolved",
      "No red gate is papered over"
    ]
  },
  "execution_log": [
    {
      "timestamp": "2026-08-07T00:00:00Z",
      "action": "seeded",
      "by": "GLS-CONSOLIDATION",
      "notes": "Seeded from the 2026-08-07 estate consolidation. Durable rationale in .agents/tasks/consolidation-source/."
    },
    {
      "timestamp": "2026-09-08T06:32:26+07:00",
      "action": "Reviewed remaining acceptance and repeat-work boundary",
      "by": "LIBRARY-ASTRA",
      "notes": "The last accepted Library integration Event reports unresolved People Graph success criteria, not an accepted adversarial release gate. Ownership and selected-P0 replay evidence remain unestablished; no source/runtime repair is claimed by this Library review."
    }
  ]
}
